{
  "business": {
    "name": "Rosa's Kitchen",
    "slug": "rosas-kitchen",
    "category": "restaurant"
  },
  "archetype": {
    "assigned": "FAMILY BUSINESS",
    "rationale": "Named owner Rosa, family narrative in data, reviews describe personal attention and kids welcome — the owner is the differentiator.",
    "runner_up_rejected": {
      "name": "LOCAL TRUST",
      "reason": "LOCAL TRUST fits the neighborhood angle, but owner identity is the stronger signal in reviews and notes."
    }
  },
  "positioning": {
    "category": {
      "value": "Family-run neighborhood kitchen",
      "evidence": "owner_name, owner_story, owner_provided_notes"
    },
    "price_level": {
      "value": "mid",
      "evidence": "menu prices $7–19"
    },
    "customer_type": {
      "value": "Families and neighbors who know Rosa by name",
      "evidence": "Angela F. review; Sunday hours"
    },
    "main_selling_point": {
      "value": "Rosa's Sunday roast and personal attention in the dining room",
      "evidence": "owner_story; Tom H. review"
    },
    "competitive_advantage": {
      "value": "Owner still cooking and greeting tables after 25 years on Elm Street",
      "evidence": "owner_story; owner_provided_notes"
    }
  },
  "cta": {
    "primary": { "label": "Call Rosa's", "action": "tel", "target": null },
    "secondary": { "label": "Get directions", "action": "directions", "target": null },
    "utility": ["Call", "Directions", "Hours"]
  },
  "section_order": [
    { "id": "hero", "purpose": "Warm welcome", "layout_pattern": "B", "density": "medium" },
    { "id": "owner-story", "purpose": "Rosa's story", "layout_pattern": "I", "density": "open" },
    { "id": "menu-highlights", "purpose": "Family signatures", "layout_pattern": "C", "density": "medium" },
    { "id": "atmosphere", "purpose": "Garden and dining room", "layout_pattern": "H", "density": "open" },
    { "id": "social-proof", "purpose": "Family reviews", "layout_pattern": "E", "density": "medium" },
    { "id": "visit", "purpose": "Visit Rosa's", "layout_pattern": "G", "density": "tight" },
    { "id": "footer", "purpose": "Essentials", "layout_pattern": "J", "density": "tight" }
  ],
  "design_direction": {
    "tone": "Warm and personal — like a neighbor inviting you in",
    "typography": { "headings": "Literata", "body": "Nunito Sans" },
    "color": "Warm amber and garden green from patio and kitchen",
    "layout_rhythm": "Story before menu, generous whitespace",
    "imagery_priority": "Rosa's food and garden patio over styled interiors",
    "do_not": ["Corporate restaurant tone", "Generic family-restaurant stock phrases"]
  },
  "gaps": [],
  "confidence": "high"
}
