{
  "business": {
    "name": "Atelier Noir",
    "slug": "atelier-noir",
    "category": "restaurant"
  },
  "archetype": {
    "assigned": "LUXURY",
    "rationale": "€185 tasting menu, reservation required, single seating, reviews describe occasion dining and advance booking — premium restrained experience.",
    "runner_up_rejected": {
      "name": "EXPERIENCE DRIVEN",
      "reason": "Experience is present, but price level and reservation-only model place this firmly in luxury."
    }
  },
  "positioning": {
    "category": {
      "value": "Fine dining tasting menu",
      "evidence": "menu, hours_note, owner_provided_notes"
    },
    "price_level": {
      "value": "luxury",
      "evidence": "€185 tasting menu"
    },
    "customer_type": {
      "value": "Guests planning a special-occasion dinner",
      "evidence": "Claire D. review — reservation three months out"
    },
    "main_selling_point": {
      "value": "Seven-course seasonal tasting with a signature langoustine course",
      "evidence": "menu; Claire D. review"
    },
    "competitive_advantage": {
      "value": "Single-seating format with invisible, precise service",
      "evidence": "Henrik A. review; hours_note"
    }
  },
  "cta": {
    "primary": { "label": "Reserve", "action": "url", "target": "reserve_url" },
    "secondary": { "label": "Call", "action": "tel", "target": null },
    "utility": ["Reserve", "Call", "Directions"]
  },
  "section_order": [
    { "id": "hero", "purpose": "Restrained identity, reserve CTA", "layout_pattern": "A", "density": "open" },
    { "id": "menu-highlights", "purpose": "Tasting experience", "layout_pattern": "C", "density": "open" },
    { "id": "atmosphere", "purpose": "Dining salon atmosphere", "layout_pattern": "H", "density": "open" },
    { "id": "social-proof", "purpose": "Select reviews", "layout_pattern": "E", "density": "open" },
    { "id": "faq", "purpose": "Booking expectations", "layout_pattern": "F", "density": "medium" },
    { "id": "private-dining", "purpose": "Salon privé", "layout_pattern": "I", "density": "open" },
    { "id": "visit", "purpose": "Location and seating times", "layout_pattern": "G", "density": "medium" },
    { "id": "footer", "purpose": "Essentials", "layout_pattern": "J", "density": "tight" }
  ],
  "design_direction": {
    "tone": "Restrained and precise — let the courses speak",
    "typography": { "headings": "Bodoni Moda", "body": "Jost" },
    "color": "Near-black and warm ivory — no bright accents",
    "layout_rhythm": "Slow scroll, generous whitespace, four items max in menu",
    "imagery_priority": "Plated courses and salon over crowd shots",
    "do_not": [
      "Bright accent colors",
      "Walk-in or casual CTAs",
      "Dense menu grids"
    ]
  },
  "gaps": [],
  "confidence": "high"
}
