{
  "business": {
    "name": "Phở & Bún Cô Lan",
    "slug": "pho-bun-co-lan",
    "category": "restaurant"
  },
  "archetype": {
    "assigned": "LOCAL TRUST",
    "rationale": "Walk-in breakfast and lunch counter on a residential street. Reviews emphasize regulars, cash service, and broth quality — not reservations or occasion dining.",
    "runner_up_rejected": {
      "name": "FAMILY BUSINESS",
      "reason": "No named owner story in data; the draw is the bowl and the morning routine, not a family narrative."
    }
  },
  "positioning": {
    "category": {
      "value": "Vietnamese phở and bún counter",
      "evidence": "review_themes, owner_provided_notes"
    },
    "price_level": {
      "value": "budget",
      "evidence": "reviews mention generous portions for price; lunch-only hours"
    },
    "customer_type": {
      "value": "Neighborhood regulars and nearby office workers",
      "evidence": "hours 6 AM–2 PM; reviews mention morning visits"
    },
    "main_selling_point": {
      "value": "Clear-broth phở served early while herbs are still fresh",
      "evidence": "review from Minh T.; review_themes"
    },
    "competitive_advantage": {
      "value": "Same family at the counter for years on a street with many noodle shops",
      "evidence": "Hoàng L. review"
    }
  },
  "cta": {
    "primary": { "label": "Get directions", "action": "directions", "target": null },
    "secondary": { "label": "Call ahead", "action": "tel", "target": null },
    "utility": ["Call", "Directions", "Hours"]
  },
  "section_order": [
    { "id": "hero", "purpose": "Recognize the shop and act", "layout_pattern": "B", "density": "medium" },
    { "id": "menu-highlights", "purpose": "What to order from review themes", "layout_pattern": "C", "density": "tight" },
    { "id": "atmosphere", "purpose": "Room and counter proof", "layout_pattern": "E", "density": "medium" },
    { "id": "social-proof", "purpose": "Google review confidence", "layout_pattern": "D", "density": "medium" },
    { "id": "visit", "purpose": "Address, hours, directions", "layout_pattern": "G", "density": "tight" },
    { "id": "footer", "purpose": "Repeat essentials", "layout_pattern": "J", "density": "tight" }
  ],
  "design_direction": {
    "tone": "Direct and practical — morning regulars, no fuss",
    "typography": { "headings": "Fraunces", "body": "Work Sans" },
    "color": "Warm terracotta and paper cream from storefront signage",
    "layout_rhythm": "Practical info high, fast scroll to directions",
    "imagery_priority": "Storefront and bowls over interior styling",
    "do_not": [
      "Reservation-first hero",
      "Dark gradient overlay hero",
      "Fabricated menu prices"
    ]
  },
  "gaps": ["No written menu in data — using review-led highlights"],
  "confidence": "high"
}
